{"schema_version":"1.0","record_type":"technology_trend_run","timezone":"America/Los_Angeles","run_id":"technology-trends-2026-09-18","scheduled_for":"2026-09-18T08:00:00-07:00","observed_at":"2026-09-18T07:59:17-07:00","window_start":"2026-08-31T08:13:32-07:00","window_end":"2026-09-18T07:59:17-07:00","status":"success","report_path":"reports/2026/2026-09-18/technology-trend-update-technology-trends-2026-09-18.html","methodology":{"finding_count":5,"observation_window_basis":"Window starts at the previous successful canonical run's window_end and ends at the current observation cutoff; the unusually long window reflects missed persisted weekday runs.","ranking_basis":"Signal strength rather than popularity, emphasizing difficult-to-reverse commercialization, deployment, manufacturing, infrastructure, regulatory, and technical milestones.","source_policy":"Prefer primary company, government, regulatory, and research-institution sources.","repeat_policy":"Canonical event fingerprints were checked; repeated events are included only for material updates with preserved event_key and material_update_from.","selection_focus":["commercialization","deployment","manufacturing capacity","infrastructure buildout","strategic partnerships","geographic expansion","regulatory approval","meaningful technical milestones"],"excluded_noise":["consumer-gadget noise","routine software updates","generic funding announcements","repetitive coverage without substantive change"]},"provenance":{"kind":"live-run","source":"Scheduled Technology Trend Update execution","imported_at":null,"notes":"First production run after scheduled-runtime persistence preflight passed."},"findings":[{"rank":1,"finding_id":"nvidia-australia-2gw-ai-infrastructure-2026-09-18","event_key":"nvidia-australia-2gw-ai-infrastructure","headline":"NVIDIA partners target up to 2 GW of Australian AI infrastructure by 2027","summary":"NVIDIA said Australian cloud and data-center partners plan up to a 2-gigawatt buildout by 2027 around NVIDIA DSX infrastructure.","why_it_matters":"A multi-gigawatt regional commitment is difficult-to-reverse evidence that sovereign and regional AI capacity expansion remains capital intensive and geographically broad.","trend_statement":"AI infrastructure continues scaling from individual clusters toward utility-scale regional capacity.","material_update_from":null,"source_links":[{"title":"NVIDIA — Australia AI infrastructure capacity","url":"https://nvidianews.nvidia.com/news/nvidia-expands-ai-infrastructure-capacity-in-partnership-with-australias-data-center-ecosystem","source_type":"primary-company-announcement","published_at":"2026-09-09"}],"category_ids":["ai-computing","energy","enabling-infrastructure"]},{"rank":2,"finding_id":"waymo-las-vegas-public-autonomous-rides-2026-09-18","event_key":"waymo-las-vegas-public-autonomous-rides","headline":"Waymo begins fully autonomous public rides in Las Vegas","summary":"Waymo began serving public riders in Las Vegas on September 14 across a nearly 24-mile service area using its sixth-generation Driver and Ojai vehicles.","why_it_matters":"Commercial rider service is stronger evidence than mapping or testing and extends fully autonomous ride-hailing into another major U.S. market.","trend_statement":"Robotaxi deployment continues moving from pilots toward multi-city commercial operations.","material_update_from":null,"source_links":[{"title":"Waymo — Las Vegas public rides","url":"https://waymo.com/intl/es/blog/2026/09/ride-in-las-vegas/","source_type":"primary-company-announcement","published_at":"2026-09-14"}],"category_ids":["robotics-autonomy","transportation"]},{"rank":3,"finding_id":"siemens-pg-global-ai-quality-inspection-2026-09-18","event_key":"siemens-pg-global-ai-quality-inspection","headline":"Siemens and P&G scale AI quality inspection across manufacturing operations worldwide","summary":"P&G is expanding Siemens-based AI inspection across manufacturing operations worldwide; Siemens reports 10–20% scrap reduction and deployments commissioned five to ten times faster than traditional vision systems.","why_it_matters":"Measured operating gains and global rollout show industrial AI crossing from pilots into repeatable production deployment.","trend_statement":"Industrial AI is becoming standardized production infrastructure with measurable quality and deployment benefits.","material_update_from":null,"source_links":[{"title":"Siemens — P&G global AI quality inspection rollout","url":"https://press.siemens.com/global/en/pressrelease/siemens-and-procter-gamble-roll-out-ai-based-quality-inspection-worldwide","source_type":"primary-company-announcement","published_at":"2026-09-16"}],"category_ids":["ai-computing","advanced-manufacturing"]},{"rank":4,"finding_id":"fda-fayuvi-sanfilippo-gene-therapy-approval-2026-09-18","event_key":"fda-fayuvi-sanfilippo-gene-therapy-approval","headline":"FDA approves first gene therapy for Sanfilippo syndrome type A","summary":"FDA approved Fayuvi, the first treatment for pediatric MPS IIIA, a rare progressive neurodevelopmental disease previously managed only symptomatically.","why_it_matters":"A disease-modifying gene therapy reached regulatory approval in an indication with no prior approved treatment.","trend_statement":"Gene therapy continues converting rare-disease programs into approved commercial treatments.","material_update_from":null,"source_links":[{"title":"FDA — First gene therapy for pediatric Sanfilippo syndrome type A","url":"https://www.fda.gov/news-events/press-announcements/fda-approves-first-gene-therapy-pediatric-patients-sanfilippo-syndrome-type","source_type":"primary-regulatory-announcement","published_at":"2026-09-17"}],"category_ids":["biotech"]},{"rank":5,"finding_id":"nasa-roman-instrument-activation-2026-09-18","event_key":"nasa-roman-space-telescope-launch","headline":"NASA activates Roman’s primary instrument and checks out its coronagraph in space","summary":"NASA successfully activated Roman’s 300-megapixel Wide Field Instrument and performed initial checks of its Coronagraph Instrument after launch.","why_it_matters":"The mission moved beyond launch into verified operation of its core science hardware, materially reducing deployment risk.","trend_statement":"Roman is progressing from launch toward operational science capability.","material_update_from":"nasa-roman-space-telescope-launch-2026-08-30","source_links":[{"title":"NASA — Roman primary instrument activated","url":"https://science.nasa.gov/blogs/roman/2026/09/15/nasa-activates-romans-primary-instrument-checks-out-coronagraph/","source_type":"primary-government-announcement","published_at":"2026-09-15"}],"category_ids":["aerospace-space","enabling-infrastructure"]}],"category_assessments":[{"category_id":"ai-computing","category_name":"AI and Computing","direction":"up","velocity_score":2,"confidence":0.98,"evidence":[{"evidence_summary":"Australian partners targeted up to 2 GW of AI infrastructure by 2027.","finding_id":"nvidia-australia-2gw-ai-infrastructure-2026-09-18","source_url":"https://nvidianews.nvidia.com/news/nvidia-expands-ai-infrastructure-capacity-in-partnership-with-australias-data-center-ecosystem","source_type":"primary-company-announcement","published_at":"2026-09-09","reference_run_id":null},{"evidence_summary":"P&G is scaling AI inspection worldwide with measured production benefits.","finding_id":"siemens-pg-global-ai-quality-inspection-2026-09-18","source_url":"https://press.siemens.com/global/en/pressrelease/siemens-and-procter-gamble-roll-out-ai-based-quality-inspection-worldwide","source_type":"primary-company-announcement","published_at":"2026-09-16","reference_run_id":null}],"justification":"Large-scale compute infrastructure and production AI deployment both advanced.","compared_to_run_id":"technology-trends-2026-08-31","assessed_at":"2026-09-18T07:59:17-07:00"},{"category_id":"aerospace-space","category_name":"Aerospace and Space","direction":"up","velocity_score":1,"confidence":0.94,"evidence":[{"evidence_summary":"Roman's Wide Field Instrument was successfully activated in space.","finding_id":"nasa-roman-instrument-activation-2026-09-18","source_url":"https://science.nasa.gov/blogs/roman/2026/09/15/nasa-activates-romans-primary-instrument-checks-out-coronagraph/","source_type":"primary-government-announcement","published_at":"2026-09-15","reference_run_id":null}],"justification":"Roman crossed a post-launch commissioning milestone, though no new launch-scale commitment occurred.","compared_to_run_id":"technology-trends-2026-08-31","assessed_at":"2026-09-18T07:59:17-07:00"},{"category_id":"robotics-autonomy","category_name":"Robotics and Autonomy","direction":"up","velocity_score":2,"confidence":0.98,"evidence":[{"evidence_summary":"Waymo began fully autonomous public rides in Las Vegas.","finding_id":"waymo-las-vegas-public-autonomous-rides-2026-09-18","source_url":"https://waymo.com/intl/es/blog/2026/09/ride-in-las-vegas/","source_type":"primary-company-announcement","published_at":"2026-09-14","reference_run_id":null}],"justification":"Commercial autonomous service expanded into another major city.","compared_to_run_id":"technology-trends-2026-08-31","assessed_at":"2026-09-18T07:59:17-07:00"},{"category_id":"advanced-manufacturing","category_name":"Advanced Manufacturing","direction":"up","velocity_score":2,"confidence":0.97,"evidence":[{"evidence_summary":"P&G is rolling out AI quality inspection globally with 10–20% scrap reduction.","finding_id":"siemens-pg-global-ai-quality-inspection-2026-09-18","source_url":"https://press.siemens.com/global/en/pressrelease/siemens-and-procter-gamble-roll-out-ai-based-quality-inspection-worldwide","source_type":"primary-company-announcement","published_at":"2026-09-16","reference_run_id":null}],"justification":"Measured factory benefits and worldwide rollout indicate production-scale adoption.","compared_to_run_id":"technology-trends-2026-08-31","assessed_at":"2026-09-18T07:59:17-07:00"},{